{
  "schema_version": "1.0",
  "date": "2026-10-19",
  "executed_at": "2026-10-20T00:00:33.551484Z",
  "run_id": "2026-10-17-ai_industry",
  "domain": "ai_industry",
  "locale": "en",
  "window": {
    "from": "2026-10-17T11:00:33.551417+11:00",
    "to": "2026-10-20T11:00:33.551417+11:00",
    "timezone": "Australia/Sydney",
    "days": 3
  },
  "generated_at": "2026-10-20T11:00:33.551417+11:00",
  "status": "ok",
  "status_detail": null,
  "trends": [
    {
      "canonical_id": "1a9406ce44a5166f",
      "run_trend_id": "GLOBAL_20261020_INFERENCE_ECONOMICS_FLASH_CODING_MODELS",
      "name": "Lightweight coding models compete on performance and price",
      "category": "inference_economics",
      "primary_region": "全球",
      "secondary_regions": [
        "中国"
      ],
      "lifecycle_stage": "emerging",
      "momentum": "accelerating",
      "impact_level": "high",
      "opportunity_level": "high",
      "confidence_level": "high",
      "summary": "MiniMax M3.1 Flash and DeepSeek V4.1 Flash launched in the same period with coding and agent tasks as their focus, with competition centered on throughput, task cost, and open-source deployability.",
      "attention_driver": "The usable performance of low-cost models on coding leaderboards and agent tasks is prompting teams to compare their default model mix again.",
      "evidence": [
        {
          "url": "https://minimax.io/blog/minimax-m31f",
          "quote": "MiniMax 发布 M3.1 Flash，推理提速近三倍、用量成本降低 70%",
          "claim": "Supports MiniMax positioning its new model as a faster, lower-cost inference option.",
          "source_tier": "attention",
          "used_for": "impact"
        },
        {
          "url": "https://the-decoder.com/minimax-m3-1-flash-shows-chinas-ai-price-race-has-no-floor-in-sight",
          "quote": "42 on the Artificial Analysis Intelligence Index, at half the cost.",
          "claim": "Supports the new generation of lightweight models competing on price-performance.",
          "source_tier": "independent_validation",
          "used_for": "impact"
        },
        {
          "url": "https://x.com/arena/status/2111894091168682086",
          "quote": "DeepSeek-V4.1-Flash-20261017 登顶 Code Arena: WebDev 开源模型榜首",
          "claim": "Supports DeepSeek Flash receiving leading attention in open-source web development evaluations.",
          "source_tier": "attention",
          "used_for": "momentum"
        },
        {
          "url": "https://reddit.com/r/LocalLLaMA/comments/1x9umtv/deepseek_v41_flash_at_261_bpw_engram_26_ts_on",
          "quote": "DeepSeek V4.1 Flash at 2.61 bpw + Engram: 26 t/s on dual RTX 3090s",
          "claim": "Supports the community exploring deployment of DeepSeek Flash under low-VRAM conditions.",
          "source_tier": "attention",
          "used_for": "creator_relevance"
        }
      ],
      "first_detected": "2026-10-17T10:05:08Z",
      "last_signal_update": "2026-10-19T18:22:30Z",
      "so_what": "Add model routing and task-level cost tracking to the near-term roadmap. High-frequency coding and batch agent tasks should no longer default to the most expensive models. Procurement evaluations should consider real task success rates, latency, and cost per completion."
    },
    {
      "canonical_id": "b0080cbe961226f5",
      "run_trend_id": "GLOBAL_20261020_SAFETY_AND_GOVERNANCE_AGENT_EXTERNAL_ACTIONS",
      "name": "Permission and liability pressure rises for agent external actions",
      "category": "safety_and_governance",
      "primary_region": "全球",
      "secondary_regions": [
        "美国",
        "德国"
      ],
      "lifecycle_stage": "declining",
      "momentum": "accelerating",
      "impact_level": "high",
      "opportunity_level": "medium",
      "confidence_level": "medium",
      "summary": "Use cases for agents to shop, access websites, and operate enterprise tools are expanding, alongside risk signals involving account abuse, website blocking, and liability for generated content.",
      "attention_driver": "Real transactions and system access expand what agents can execute, while increasing the importance of permissions, auditing, and compensation liability.",
      "evidence": [
        {
          "url": "https://the-decoder.com/stripe-says-ai-agent-purchases-are-adding-up-but-it-wont-share-the-numbers",
          "quote": "AI agents are increasingly using Stripe's payment service Link to shop for their users",
          "claim": "Supports agents beginning to enter real payment and purchasing flows.",
          "source_tier": "independent_validation",
          "used_for": "existence"
        },
        {
          "url": "https://techcrunch.com/2026/10/19/microsoft-says-ai-agents-are-like-insider-threats-as-frontier-models-cant-be-trusted",
          "quote": "Microsoft wants enterprises to closely watch the agents employees use",
          "claim": "Supports enterprises treating agent access as an internal permission governance issue.",
          "source_tier": "attention",
          "used_for": "impact"
        },
        {
          "url": "https://techcrunch.com/2026/10/19/hackers-hit-ai-coding-tool-opencode-running-up-charges-on-users-ai-accounts",
          "quote": "Hackers hit AI coding tool OpenCode, running up charges on users’ AI accounts",
          "claim": "Supports real loss risks emerging around account and usage controls for agent tools.",
          "source_tier": "attention",
          "used_for": "impact"
        },
        {
          "url": "https://the-decoder.com/two-german-courts-now-hold-google-liable-for-what-its-ai-overviews-say",
          "quote": "Two German courts now hold Google liable for what its AI overviews say",
          "claim": "Supports judicial attention toward liability for the outputs of generative systems.",
          "source_tier": "independent_validation",
          "used_for": "impact"
        }
      ],
      "first_detected": "2026-10-19T12:51:12Z",
      "last_signal_update": "2026-10-19T22:49:02Z",
      "so_what": "For features that can spend money, access the internet, or change external systems, use tiered authorization, spending limits, and auditable records by default. Product acceptance testing must measure refusal, human escalation, and reversal paths alongside task completion rates."
    },
    {
      "canonical_id": "3dde9b37443bca91",
      "run_trend_id": "GLOBAL_20261020_HARDWARE_AND_INFRA_CLOUD_CAPACITY_REPRICING",
      "name": "Compute supply enters a period of consolidation and alternatives",
      "category": "hardware_and_infra",
      "primary_region": "全球",
      "secondary_regions": [
        "美国"
      ],
      "lifecycle_stage": "dormant",
      "momentum": "stable",
      "impact_level": "medium",
      "opportunity_level": "medium",
      "confidence_level": "medium",
      "summary": "Funding and procurement pressure facing emerging AI cloud providers is drawing attention, while AWS continues to lower the barrier to running Hugging Face models on Trainium.",
      "attention_driver": "Large-scale compute contracts and software tools for alternative chips coexist, making inference capacity, vendor concentration, and migration costs operational variables for product teams.",
      "evidence": [
        {
          "url": "https://the-decoder.com/the-neocloud-shakeout-is-coming-and-nvidia-has-the-most-to-lose",
          "quote": "only seven to ten of the hundreds of AI cloud providers to survive",
          "claim": "Supports rising market expectations of consolidation among emerging AI cloud providers.",
          "source_tier": "independent_validation",
          "used_for": "impact"
        },
        {
          "url": "https://techcrunch.com/2026/10/19/amazon-is-taking-its-biggest-shot-at-nvidia-yet-with-new-torchneuron-dev-tool",
          "quote": "Amazon wants to break Nvidia’s hold on PyTorch",
          "claim": "Supports alternative accelerators competing for PyTorch workloads through development tools.",
          "source_tier": "attention",
          "used_for": "momentum"
        },
        {
          "url": "https://huggingface.co/blog/hf-torchneuron",
          "quote": "TorchNeuron: running HF models on AWS Trainium is easier than ever",
          "claim": "Supports continued reductions in the barrier to using Trainium with Hugging Face models.",
          "source_tier": "independent_validation",
          "used_for": "existence"
        },
        {
          "url": "https://techcrunch.com/2026/10/19/nscale-and-anthropic-are-reportedly-in-talks-for-yet-another-45-billion-compute-deal",
          "quote": "discussing yet another deal of the same magnitude",
          "claim": "Supports major model companies continuing to pursue discussions on hyperscale compute procurement.",
          "source_tier": "attention",
          "used_for": "sentiment"
        }
      ],
      "first_detected": "2026-10-19T00:00:00Z",
      "last_signal_update": "2026-10-19T23:39:38Z",
      "so_what": "Separate inference deployment into portable model, runtime, and observability layers to avoid lock-in to a single cloud or chip path. Products with large capacity commitments should retain failover mechanisms and unit-cost review processes."
    }
  ],
  "watch_list": [],
  "trend_evolution": [],
  "coverage": {
    "sources_configured": 93,
    "source_keys_reporting": 76,
    "signals_raw": 470,
    "signals_accepted": 453,
    "clusters_total": 269,
    "clusters_synthesized": 119,
    "by_source": {
      "amazon": 1,
      "anthropic": 1,
      "apple_podcasts_a16z_podcast": 3,
      "apple_podcasts_the_cognitive_revolution": 1,
      "ars_technica_ai": 4,
      "astral_codex_ten": 1,
      "brave_search_ai": 105,
      "chipsandcheese": 1,
      "crunchbase_news": 2,
      "ec_digital_strategy": 1,
      "eetimes": 4,
      "exponential_view": 2,
      "github": 16,
      "github_awesome_claude": 2,
      "github_awesome_llm": 2,
      "github_claude_skills": 12,